<?xml version="1.0" encoding="UTF-8"?>

<?pybill config="config-en"?>

<pbd:accounting-document xmlns:xsi="http://www.w3.org/2001/XMLSchema-instance"
                xsi:schemaLocation="http://www.logilab.org/2010/PyBillDocument
                                    ../../xmlschema/pybill-document-1_0.xsd"
                         xmlns:pbd="http://www.logilab.org/2010/PyBillDocument"
                         pbd:type="bill"
                         pbd:format-version="PBD-1.0">
  <pbd:metadata>
    <pbd:id>F-025</pbd:id>
    <pbd:doc-ref>FACT-2008/0025</pbd:doc-ref>
    <pbd:place>Paris</pbd:place>
    <pbd:date>march 28th, 2008</pbd:date>
    <pbd:info pbd:name="Your ref">01234</pbd:info>
    <pbd:info pbd:name="Purchase">PURCH-012345</pbd:info>
    <pbd:info pbd:name="Supplier">SUPPL-012345</pbd:info>
  </pbd:metadata>

  <pbd:address pbd:role="from">
    <pbd:firstname>Jean</pbd:firstname>
    <pbd:surname>Valjean</pbd:surname>
    <pbd:phone>(+33) 1 11 11 11 11</pbd:phone>
    <pbd:email>j.valjean@mairie-montreuil-sur-mer.fr</pbd:email>
  </pbd:address>

  <pbd:address pbd:role="to">
    <pbd:honorific>Mr</pbd:honorific>
    <pbd:firstname>Sherlock</pbd:firstname>
    <pbd:surname>Holmes</pbd:surname>
    <pbd:affiliation>
      <pbd:orgname>Holmes Inquiries</pbd:orgname>
      <pbd:jobtitle>Chief Detective</pbd:jobtitle>
      <pbd:address>
	<pbd:street>Baker street, 42ndB</pbd:street>
	<pbd:postcode>65624</pbd:postcode>
	<pbd:city>LONDON</pbd:city>
	<pbd:country>UNITED KINGDOM</pbd:country>
      </pbd:address>
    </pbd:affiliation>
  </pbd:address>

  <pbd:items-list>
    <pbd:item>
      <pbd:qty>100.0</pbd:qty>
      <pbd:description>
	<pbd:title>Pin</pbd:title>
      </pbd:description>
      <pbd:unit-price>0.01436</pbd:unit-price>
      <pbd:vat-rate>19.6</pbd:vat-rate>
    </pbd:item>
    <pbd:item>
      <pbd:qty>100.0</pbd:qty>
      <pbd:description>
	<pbd:title>Pin</pbd:title>
      </pbd:description>
      <pbd:unit-price pbd:digits="3">0.01436</pbd:unit-price>
      <pbd:vat-rate>19.6</pbd:vat-rate>
    </pbd:item>
    <pbd:item>
      <pbd:qty>100.0</pbd:qty>
      <pbd:description>
	<pbd:title>Pin</pbd:title>
      </pbd:description>
      <pbd:unit-price pbd:digits="5">0.01436</pbd:unit-price>
      <pbd:vat-rate>19.6</pbd:vat-rate>
    </pbd:item>
  </pbd:items-list>

  <pbd:payment-terms>International funds transfer</pbd:payment-terms>

</pbd:accounting-document>
